{
  "schemaVersion": 1,
  "format": "eval4j-run",
  "runId": "01JAGXW2K7CANDIDATE000148-agents",
  "runNumber": 148,
  "status": "COMPLETE",
  "startedAt": "2026-10-03T10:14:00Z",
  "endedAt": "2026-10-03T10:16:41Z",
  "durationMs": 161000,
  "project": {
    "name": "Support agent"
  },
  "source": {
    "branch": "feature/refund-policy",
    "commit": "9f2c4e1",
    "dirty": false,
    "ci": {
      "provider": "jenkins",
      "buildNumber": "148"
    }
  },
  "profile": {
    "name": "BUILD",
    "judgeBudgetUsd": 2.0,
    "carryOver": true
  },
  "env": {
    "agents": [
      {
        "id": "support-agent",
        "provider": "ollama",
        "model": "llama3.3:70b",
        "promptId": "support-agent.md",
        "promptVersion": "support-agent v3",
        "tools": [
          "order_lookup",
          "kb_search",
          "refund",
          "handoff"
        ]
      }
    ],
    "judges": [
      {
        "id": "judge-main",
        "provider": "google",
        "model": "gemini-2.5-pro",
        "temperature": 0.0,
        "samples": 3,
        "aggregation": "MEAN",
        "rubricId": "judge-rubrics",
        "rubricVersion": "1.4",
        "stats": {
          "calls": 289,
          "cacheHits": 153,
          "latencyMeanMs": 1900,
          "latencyP95Ms": 3400,
          "tokensIn": 115600,
          "tokensOut": 15895,
          "costUsd": 0.2249,
          "failures": 0,
          "retries": 0
        }
      }
    ],
    "datasets": [
      {
        "id": "support-scenarios",
        "name": "support-scenarios.yaml",
        "path": "src/test/resources/support-scenarios.yaml",
        "revision": "12",
        "hash": "44f4cdb2f1d8a9575e4a4501365904b9",
        "scenarioCount": 36
      }
    ],
    "eval4jVersion": "5.1",
    "javaVersion": "17.0.12",
    "configHash": "6c760e2d9f59a7ab"
  },
  "metrics": [
    {
      "name": "Answer Correctness",
      "kind": "JUDGE",
      "family": "agents",
      "facet": "answers",
      "dimension": "correctness",
      "threshold": 0.7,
      "judgeId": "judge-main",
      "id": "answer-correctness"
    },
    {
      "name": "Answer Relevancy",
      "kind": "JUDGE",
      "family": "agents",
      "facet": "answers",
      "dimension": "relevancy",
      "threshold": 0.7,
      "judgeId": "judge-main",
      "id": "answer-relevancy"
    },
    {
      "name": "Faithfulness",
      "kind": "JUDGE",
      "family": "agents",
      "facet": "answers",
      "dimension": "grounding",
      "threshold": 0.7,
      "judgeId": "judge-main",
      "id": "faithfulness"
    },
    {
      "name": "Toxicity",
      "kind": "JUDGE",
      "family": "agents",
      "facet": "answers",
      "dimension": "safety",
      "threshold": 0.8,
      "judgeId": "judge-main",
      "id": "toxicity"
    },
    {
      "name": "Contextual Precision",
      "kind": "JUDGE",
      "family": "retrieval",
      "facet": "rag",
      "dimension": "retrieval",
      "threshold": 0.7,
      "judgeId": "judge-main",
      "id": "contextual-precision"
    },
    {
      "name": "Latency p95",
      "kind": "MEASURED",
      "family": "agents",
      "facet": "answers",
      "dimension": "efficiency",
      "unit": "s",
      "budget": 4.0,
      "id": "latency-p95"
    },
    {
      "name": "Token budget",
      "kind": "MEASURED",
      "family": "agents",
      "facet": "answers",
      "dimension": "efficiency",
      "unit": "tokens",
      "budget": 3000.0,
      "id": "token-budget"
    },
    {
      "name": "Tool Order",
      "kind": "ASSERTION",
      "family": "agents",
      "facet": "tools",
      "dimension": "reasoning",
      "threshold": 1,
      "id": "tool-order"
    }
  ],
  "summary": {
    "evaluations": 240,
    "passed": 210,
    "failed": 28,
    "notEvaluated": 2,
    "errors": 0,
    "bySource": {
      "FRESH": 180,
      "REUSED": 51,
      "CARRIED": 9
    },
    "costUsd": 0.2249
  },
  "groupId": "build-148"
}